{
  "schema_version": 1,
  "benchmark_case_id": "software_repair_envelope_address_boundary",
  "domain": "software_repair",
  "split": "holdout",
  "title": "Sealed transfer test for envelope addresses",
  "issue": {
    "goal": "Reject malformed envelope addresses while preserving valid packet and master addresses.",
    "defect_class": "missing_boundary_validation",
    "acceptance_claims": [
      "Malformed delimited inputs are rejected.",
      "Valid envelope-address inputs and the privileged branch preserve their behavior.",
      "The patch changes only the narrow source boundary."
    ]
  },
  "repository": {
    "kind": "controlled_fixture",
    "fixture_path": "md-os/benchmarks/software_repair/fixtures/envelope_address_boundary",
    "source_tree_sha256": "40c7294389f5d91df524748c11c5ce52aa96172409c0c914b43559fc03a8c072",
    "expected_base_commit": "b5a5e37310c930a8d1757d50cb2c359aa8252a96"
  },
  "execution_policy": {
    "isolation": "git_worktree_process",
    "allowed_executables": [
      "node"
    ],
    "network": "disabled_by_contract",
    "third_party_repositories": "not_supported"
  },
  "reproduction": {
    "command_id": "reproduce_envelope_address_boundary",
    "argv": [
      "node",
      "checks/targeted.check.js"
    ],
    "cwd": "candidate",
    "expected_before_exit_status": 1,
    "expected_after_exit_status": 0
  },
  "targeted_tests": [
    {
      "command_id": "targeted_envelope_address_boundary_test",
      "argv": [
        "node",
        "checks/targeted.check.js"
      ],
      "cwd": "candidate",
      "expected_before_exit_status": 1,
      "expected_after_exit_status": 0
    }
  ],
  "regression_tests": [
    {
      "command_id": "regression_envelope_address_boundary_test",
      "argv": [
        "node",
        "checks/regression.check.js"
      ],
      "cwd": "candidate",
      "expected_before_exit_status": 0,
      "expected_after_exit_status": 0
    }
  ],
  "oracle_tests": [
    {
      "command_id": "independent_envelope_address_boundary_oracle",
      "argv": [
        "node",
        "md-os/benchmarks/software_repair/oracles/envelope_address_boundary_oracle.js",
        "{candidate_root}"
      ],
      "cwd": "workspace",
      "expected_before_exit_status": 1,
      "expected_after_exit_status": 0,
      "independent": true
    }
  ],
  "diff_policy": {
    "allowed_paths": [
      "src/**"
    ],
    "forbidden_paths": [
      "checks/**"
    ],
    "max_files_changed": 1,
    "max_diff_bytes": 4096,
    "require_non_empty_diff": true
  },
  "resource_budget": {
    "max_candidates": 5,
    "command_timeout_ms": 5000
  },
  "ground_truth": {
    "owner": "independent_benchmark_verifier",
    "oracle_access": "verifier_only",
    "candidate_disclosure": "withheld_until_verification",
    "specification_validity_checks": [
      "The defect is reproduced by a failing test before patching.",
      "An oracle outside the candidate worktree checks valid and invalid boundary cases.",
      "Regression tests preserve valid and privileged behavior.",
      "Diff policy prevents a candidate from changing visible tests."
    ]
  }
}
