{
  "schema_version": 1,
  "benchmark_case_id": "software_repair_route_descriptor_boundary",
  "domain": "software_repair",
  "split": "holdout",
  "title": "Sealed transfer test for route descriptors",
  "issue": {
    "goal": "Reject malformed route descriptors while preserving valid node and operations routes.",
    "defect_class": "missing_boundary_validation",
    "acceptance_claims": [
      "Malformed delimited inputs are rejected.",
      "Valid route-descriptor inputs and the privileged branch preserve their behavior.",
      "The patch changes only the narrow source boundary."
    ]
  },
  "repository": {
    "kind": "controlled_fixture",
    "fixture_path": "md-os/benchmarks/software_repair/fixtures/route_descriptor_boundary",
    "source_tree_sha256": "89a94ec69b189446985c91aedbd8e2f8725d4e9ecc04b5b6684890e2ed4965bf",
    "expected_base_commit": "d0ff2913d57fcfa29d2e677486a7fe8d182539a5"
  },
  "execution_policy": {
    "isolation": "git_worktree_process",
    "allowed_executables": [
      "node"
    ],
    "network": "disabled_by_contract",
    "third_party_repositories": "not_supported"
  },
  "reproduction": {
    "command_id": "reproduce_route_descriptor_boundary",
    "argv": [
      "node",
      "checks/targeted.check.js"
    ],
    "cwd": "candidate",
    "expected_before_exit_status": 1,
    "expected_after_exit_status": 0
  },
  "targeted_tests": [
    {
      "command_id": "targeted_route_descriptor_boundary_test",
      "argv": [
        "node",
        "checks/targeted.check.js"
      ],
      "cwd": "candidate",
      "expected_before_exit_status": 1,
      "expected_after_exit_status": 0
    }
  ],
  "regression_tests": [
    {
      "command_id": "regression_route_descriptor_boundary_test",
      "argv": [
        "node",
        "checks/regression.check.js"
      ],
      "cwd": "candidate",
      "expected_before_exit_status": 0,
      "expected_after_exit_status": 0
    }
  ],
  "oracle_tests": [
    {
      "command_id": "independent_route_descriptor_boundary_oracle",
      "argv": [
        "node",
        "md-os/benchmarks/software_repair/oracles/route_descriptor_boundary_oracle.js",
        "{candidate_root}"
      ],
      "cwd": "workspace",
      "expected_before_exit_status": 1,
      "expected_after_exit_status": 0,
      "independent": true
    }
  ],
  "diff_policy": {
    "allowed_paths": [
      "src/**"
    ],
    "forbidden_paths": [
      "checks/**"
    ],
    "max_files_changed": 1,
    "max_diff_bytes": 4096,
    "require_non_empty_diff": true
  },
  "resource_budget": {
    "max_candidates": 5,
    "command_timeout_ms": 5000
  },
  "ground_truth": {
    "owner": "independent_benchmark_verifier",
    "oracle_access": "verifier_only",
    "candidate_disclosure": "withheld_until_verification",
    "specification_validity_checks": [
      "The defect is reproduced by a failing test before patching.",
      "An oracle outside the candidate worktree checks valid and invalid boundary cases.",
      "Regression tests preserve valid and privileged behavior.",
      "Diff policy prevents a candidate from changing visible tests."
    ]
  }
}
