{
  "schema_version": 1,
  "benchmark_case_id": "software_repair_session_handle_boundary",
  "domain": "software_repair",
  "split": "validation",
  "title": "Validate transfer to a session-handle boundary",
  "issue": {
    "goal": "Reject malformed session handles while preserving valid member and system handles.",
    "defect_class": "missing_boundary_validation",
    "acceptance_claims": [
      "Malformed delimited inputs are rejected.",
      "Valid session-handle inputs and the privileged branch preserve their behavior.",
      "The patch changes only the narrow source boundary."
    ]
  },
  "repository": {
    "kind": "controlled_fixture",
    "fixture_path": "md-os/benchmarks/software_repair/fixtures/session_handle_boundary",
    "source_tree_sha256": "1aa4ae1a17bf97f56cca8a342917a5a6e1877a6f20b05d2f7b309e91b5f90a87",
    "expected_base_commit": "565106f2aa94acc347cab7d7d160f254c3fbd73f"
  },
  "execution_policy": {
    "isolation": "git_worktree_process",
    "allowed_executables": [
      "node"
    ],
    "network": "disabled_by_contract",
    "third_party_repositories": "not_supported"
  },
  "reproduction": {
    "command_id": "reproduce_session_handle_boundary",
    "argv": [
      "node",
      "checks/targeted.check.js"
    ],
    "cwd": "candidate",
    "expected_before_exit_status": 1,
    "expected_after_exit_status": 0
  },
  "targeted_tests": [
    {
      "command_id": "targeted_session_handle_boundary_test",
      "argv": [
        "node",
        "checks/targeted.check.js"
      ],
      "cwd": "candidate",
      "expected_before_exit_status": 1,
      "expected_after_exit_status": 0
    }
  ],
  "regression_tests": [
    {
      "command_id": "regression_session_handle_boundary_test",
      "argv": [
        "node",
        "checks/regression.check.js"
      ],
      "cwd": "candidate",
      "expected_before_exit_status": 0,
      "expected_after_exit_status": 0
    }
  ],
  "oracle_tests": [
    {
      "command_id": "independent_session_handle_boundary_oracle",
      "argv": [
        "node",
        "md-os/benchmarks/software_repair/oracles/session_handle_boundary_oracle.js",
        "{candidate_root}"
      ],
      "cwd": "workspace",
      "expected_before_exit_status": 1,
      "expected_after_exit_status": 0,
      "independent": true
    }
  ],
  "diff_policy": {
    "allowed_paths": [
      "src/**"
    ],
    "forbidden_paths": [
      "checks/**"
    ],
    "max_files_changed": 1,
    "max_diff_bytes": 4096,
    "require_non_empty_diff": true
  },
  "resource_budget": {
    "max_candidates": 5,
    "command_timeout_ms": 5000
  },
  "ground_truth": {
    "owner": "independent_benchmark_verifier",
    "oracle_access": "verifier_only",
    "candidate_disclosure": "validation_case_withheld_from_learning",
    "specification_validity_checks": [
      "The defect is reproduced by a failing test before patching.",
      "An oracle outside the candidate worktree checks valid and invalid boundary cases.",
      "Regression tests preserve valid and privileged behavior.",
      "Diff policy prevents a candidate from changing visible tests."
    ]
  }
}
